{"omniform":"0.1","catalogVersion":"0.1.0","capabilities":[{"id":"planning","name":"Planning","description":"Plan changes.","operations":["generate_plan"]}],"operations":[{"id":"generate_plan","version":"0.1.0","name":"Generate plan","description":"Generate a plan.","capability":"planning","input":{"type":"object"},"output":{"type":"object"},"mutation":false,"permissions":["plan_company"],"approval":{"mode":"none"},"interfaces":["human","agent","api","machine"]}]}
